<?xml version="1.0"?>
<!DOCTYPE conversion SYSTEM "../config.dtd">

<conversion>
	<convertcoordinates/>

	<md3mesh>
		<inputfile>
			<filename>models/players/visor/lower.md3</filename>
		</inputfile>
		
		<outputfile>
			<filename>lower.mesh.xml</filename>
		</outputfile>
		
		<referenceframe>0</referenceframe>
		
		<animationfile>
			<filename>models/players/visor/animation.cfg</filename>
			<convertlegs/>
			<!--<convertselection>
				<animationname>LEGS_WALK</animationname>
				<animationname>LEGS_RUN</animationname>
			</convertselection>-->
		</animationfile>
		
		<animations>
			<animationsequence>
				<animationname>swim</animationname>
				<startframe>129</startframe>
				<numframes>10</numframes>
				<fps>15</fps>
			</animationsequence>
			<animationsequence>
				<animationname>die</animationname>
				<startframe>0</startframe>
				<numframes>30</numframes>
				<fps>25</fps>
			</animationsequence>
		</animations>
		
		<materials>
			<material>
				<submeshname>l_legs</submeshname>
				<materialname>visor/lower</materialname>
			</material>
		</materials>
	</md3mesh>
</conversion>
